1) Statement to create the Contact table 

mysql> create database MarketCoo;
Query OK, 0 rows affected (0.05 sec)

mysql> use MarketCoo;
Database changed

mysql> create table Contact(Contactid int primary key auto_increment, Companyid int, Firstname varchar(45), Lastname varchar(45), Street varchar(45), City varchar(45), State varchar(2), Zip varchar(10), IsMain Boolean, Email varchar(45), Phone varchar(12));
Query OK, 0 rows affected (0.05 sec)

mysql> describe Contact;
+-----------+-------------+------+-----+---------+----------------+
| Field     | Type        | Null | Key | Default | Extra          |
+-----------+-------------+------+-----+---------+----------------+
| Contactid | int         | NO   | PRI | NULL    | auto_increment |
| Companyid | int         | YES  |     | NULL    |                |
| Firstname | varchar(45) | YES  |     | NULL    |                |
| Lastname  | varchar(45) | YES  |     | NULL    |                |
| Street    | varchar(45) | YES  |     | NULL    |                |
| City      | varchar(45) | YES  |     | NULL    |                |
| State     | varchar(2)  | YES  |     | NULL    |                |
| Zip       | varchar(10) | YES  |     | NULL    |                |
| IsMain    | tinyint(1)  | YES  |     | NULL    |                |
| Email     | varchar(45) | YES  |     | NULL    |                |
| Phone     | varchar(12) | YES  |     | NULL    |                |
+-----------+-------------+------+-----+---------+----------------+
11 rows in set (0.05 sec)

2) Statement to create the Employee table

mysql> create table Employee(EmployeeID int, Firstname varchar(45), Lastname varchar(45), Salary decimal(10,2), HireDate date, JobTitle varchar(45), Email varchar(45), Phone varchar(12));
Query OK, 0 rows affected (0.14 sec)

mysql> describe Employee;
+------------+---------------+------+-----+---------+-------+
| Field      | Type          | Null | Key | Default | Extra |
+------------+---------------+------+-----+---------+-------+
| EmployeeID | int           | YES  |     | NULL    |       |
| Firstname  | varchar(45)   | YES  |     | NULL    |       |
| Lastname   | varchar(45)   | YES  |     | NULL    |       |
| Salary     | decimal(10,2) | YES  |     | NULL    |       |
| HireDate   | date          | YES  |     | NULL    |       |
| JobTitle   | varchar(45)   | YES  |     | NULL    |       |
| Email      | varchar(45)   | YES  |     | NULL    |       |
| Phone      | varchar(12)   | YES  |     | NULL    |       |
+------------+---------------+------+-----+---------+-------+
8 rows in set (0.07 sec)
mysql> INSERT INTO Employee VALUES (1, 'Jon', 'Snow', 70000, '1990-01-01', 'software Engineer', 'jon@gmail.com', 256489712);
Query OK, 1 row affected (0.24 sec)

mysql> INSERT INTO Employee VALUES (2, 'Lesley', 'Bland', 170000, '1995-01-05', 'Data Engineer', 'lesley@gmail.com', 84759462);
Query OK, 1 row affected (0.06 sec)
mysql> INSERT INTO Employee VALUES (3, 'Min', 'Hoo', 90000, '2000-01-25', 'Marketing Specialist', 'minhoo@gmail.com', 9265005596);
Query OK, 1 row affected (0.08 sec)

mysql> INSERT INTO Employee VALUES (4, 'Park', 'Jimin', 70000, '2006-12-29', 'Project Manager', 'parkg@gmail.com', 9265005478);
Query OK, 1 row affected (0.05 sec)
mysql> select * from employee;
+------------+-----------+----------+-----------+------------+----------------------+------------------+------------+
| EmployeeID | Firstname | Lastname | Salary    | HireDate   | JobTitle             | Email            | Phone      |
+------------+-----------+----------+-----------+------------+----------------------+------------------+------------+
|          1 | Jon       | Snow     |  70000.00 | 1990-01-01 | software Engineer    | jon@gmail.com    | 256489712  |
|          2 | Lesley    | Bland    | 170000.00 | 1995-01-05 | Data Engineer        | lesley@gmail.com | 84759462   |
|          3 | Min       | Hoo      |  90000.00 | 2000-01-25 | Marketing Specialist | minhoo@gmail.com | 9265005596 |
|          4 | Park      | Jimin    |  70000.00 | 2006-12-29 | Project Manager      | parkg@gmail.com  | 9265005478 |
+------------+-----------+----------+-----------+------------+----------------------+------------------+------------+
4 rows in set (0.00 sec)
mysql> update employee set Phone = '215-555-8800' where Firstname = 'Lesley' AND LastName = 'Bland';
Query OK, 1 row affected (0.07 sec)
Rows matched: 1  Changed: 1  Warnings: 0

mysql> select * from employee;
+------------+-----------+----------+-----------+------------+----------------------+------------------+--------------+
| EmployeeID | Firstname | Lastname | Salary    | HireDate   | JobTitle             | Email            | Phone        |
+------------+-----------+----------+-----------+------------+----------------------+------------------+--------------+
|          1 | Jon       | Snow     |  70000.00 | 1990-01-01 | software Engineer    | jon@gmail.com    | 256489712    |
|          2 | Lesley    | Bland    | 170000.00 | 1995-01-05 | Data Engineer        | lesley@gmail.com | 215-555-8800 |
|          3 | Min       | Hoo      |  90000.00 | 2000-01-25 | Marketing Specialist | minhoo@gmail.com | 9265005596   |
|          4 | Park      | Jimin    |  70000.00 | 2006-12-29 | Project Manager      | parkg@gmail.com  | 9265005478   |
+------------+-----------+----------+-----------+------------+----------------------+------------------+--------------+
4 rows in set (0.00 sec)
